Date,Comments
2021-06-15 10:33,"If asymptomatic patients experience long term health effects, the concern arises that patients who get covid-19 even after they've been vaccinated might be at risk for long term problems.

The number of people who get covid-19 after immunization is small, and it will get smaller as immunization of our population slows viral spread.  Moreover, vaccinated people who get covid-19 usually have mild disease or no acute symptoms.  But if mild disease can lead to long term problems in unvaccinated people, we need to know if vaccination protects against long term effects, which can be serious."
2021-06-15 10:35,Why exactly was there no control group of people who did not get covid in this study? Wouldn't that be easy to do if they already had access to insurance records? Why would any good scientific study opt to not have a control group when one could easily have been added? Seems suspicious to me as a scientist.
2021-06-15 10:37,"""Post-Covid health problems were common even among people who had not gotten sick from the virus at all, the study found.""

Perhaps the medical issues aren't being caused the virus itself, but rather by the societal response which has affected every aspect of our lives for the worse."
2021-06-15 10:48,"Just one more reason not to resume a so called normal lifestyle, not yet. Just learn about the ACE2 receptor, it’s function and the damage that this virus causes. It is metabolic, that’s why the obese were hit so hard. I won’t get on a plane or any other incubator of disease until cases are extremely rare."
2021-06-15 10:57,"The absence of a control group is a major limitation.  How many people complain of nerve or muscle pain, fatigue or memory loss everyday, pre-Covid, in my clinic? The majority."
2021-06-15 10:58,If there’s no mechanistic explanation for how all these symptoms are caused by mild COVID infections then linking all theses conditions to COVID totally unfounded. If random viral infections can have all these long-term effects how do we know these symptoms aren’t caused by some other asymptomatic viral infection?
2021-06-15 11:00,The lack of control group in this study is a weak link and makes the results borderline suspect.  Seems more like pro vaccination psy-ops.  And that’s coming from someone who opted for the vaccine.
2021-06-15 11:05,"Am I wrong, or do older Americans have a 3% increase per year of high blood pressure, high cholesterol, and aches and pains, even without Covid? This phenomenon is troubling as it relates to young people, but the numbers in the article seem skewed."
2021-06-15 11:05,"This is the reason I got the vaccine. Death is easy. I know so many ""COVID-19 is like the flu"" people, who got it and are still suffering. 

How can you have a moderate case three months ago and still are only at 50 percent baseline? That's frightening."
2021-06-15 11:05,Yet more compelling evidence that everyone needs to get vaccinated. Not that more is actually needed.
2021-06-15 11:07,"Correlation is not causation. But I think I am always going to wonder — and am never going to know — if my 77-year-old mother’s asymptomatic Covid in early November had anything to do with her utterly shocking massive brain hemorrhage in early March of this year. She was previously fit, healthy, and active, with no history of high blood pressure, and yet that is the only explanation her puzzled doctors have been able to come up with. Every time I mention her (truly asymptomatic) Covid, I am dismissed—but I do wonder if she is yet another casualty of the virus or if it’s just a coincidence. My mother never sought care after her quarantine ended, because she felt just fine; then her stroke happened right before she would have seen her doctor for her annual. If we had known that newly high blood pressure can be an effect of asymptomatic Covid, perhaps she would have gone to see her doctor earlier, or else her doctor would have urged her to come in to be evaluated. That kind of second-guessing is too painful for me to continue, but I offer this for anyone else whose senior parent(s) had a case of the virus: have them get a routine checkup without delay, just in case."
2021-06-15 11:09,"I wish someone would investigate whether these people with long-term health problems are suffering from an under diagnosed autoimmune illness called mast cell activation syndrome (MCAS). A chronic illness that can be set off by infections and viruses such as COVID-19.
It’s an underreported illness that affects multiple systems in the body. Many of us are￼ suffering from this, and histamine intolerance, a related multi-system illness, but can’t be diagnosed because it’s under the￼ radar of many mainstream doctors. There are few tests for it, and it’s often only identified by taking a careful patient history. Indeed, relies on patient self-reporting."
2021-06-15 11:11,"I appreciate this article. My wife’s (40 years old, vigorously exercises) cholesterol which was previously absolutely normal, has spiked after suffering from the virus. I’m anxious to read further about the link between cholesterol and long-haul survivors of Coronavirus."
2021-06-15 11:13,Were these symptoms also experienced by people who survived the 1918 pandemic?
2021-06-15 11:13,"“Their most common new health problems were pain, including in nerves and muscles; breathing difficulties; high cholesterol; malaise and fatigue; and high blood pressure. Other issues included intestinal symptoms; migraines; skin problems; heart abnormalities; sleep disorders; and mental health conditions like anxiety and depression.”

These are also symptoms of living with Stanley Kowalski as President."
2021-06-15 11:15,"Two days after my quarantine for testing positive for Covid I had a retina occlusion in my right eye -total, a blue/gray shade over the eye.  It cleared up day by day and I wasn’t alarmed - but of course should have been - that’s an emergency for anyone reading.  Long story short, the eye cleared up 85% in a week before an eye doctor rushed me to the ER.  4 months later my eye is now starting to slowly improve -per recent photos of internal eye via eye retina specialist.    I did have Covid and I had a heart echo and other tests to see if this was of a different cause.  No physical originators.  It’s post Covid and the retina specialist said initially ‘this is a compelling case for post-Covid.’  Now the ‘sure’ prognosis for recoveryis unsure since the cause is new.  It’s a blood clot in my eye artery."
2021-06-15 11:15,"Let’s hope that astute infectious disease and neurology physicians will begin real interrogations of the symptoms with lumbar punctures for neurotransmitters and aberrant proteins in those with brain fog and autonomic symptoms, nasal biopsies to examine nerve endings in those who cannot smell, cardiopulmonary assessments including biopsies in those with shortness of breath. There is a tremendous amount we can learn from COVID because of the high numbers of individuals about long-term sequelae from viral infections. NIH, we could gain tremendous insight into how viruses trigger lasting autoimmune and inflammatory processes through key diagnostics in these patients and unaffected family members."
2021-06-15 10:27,They didn’t compare these patients to a control group?
2021-06-15 10:53,This study is pretty meaningless without a control group. An increase of high cholesterol and blood pressure in people in their 40s and 50s??---umm....that is who is first diagnosed with high blood pressure. They have little idea is that rates are higher in post COVOD folks without a control. You should have highlighted this limitation with more care especially if you are writing fora general audience.
2021-06-15 10:50,"It boggles the mind how many people are unwilling to get the vaccine. Someone said to me she wasn't getting the vaccine because she had COVID last year and her body fought it off fine. (She’s in her young 20s.) She didn’t seem to care that if she caught it again, she would be contagious and perhaps give it to someone who might die from it. She didn’t seem to think that having COVID would be worse from being protected from it by a vaccine. 

Too many people think the vaccine, which is meant to protect you from this virus that has killed millions in the last year, is scarier than the virus itself. Hopefully studies like these will show them how ridiculous that idea is."
2021-06-15 11:13,"I am doubling up on Boxengo's comment. 

Where is the control group? Where is the comparison of the incidence of these same symptoms prior to Covid.  

This may be very significant data. Or it may be irresponsible data collection and reporting."
2021-06-15 11:20,"A lot of people delayed seeking medical care during the pandemic to avoid hospitals and doctors’ offices. It could be that after people got COVID, they were no longer worried about infection, so they went to see their doctors and were then diagnosed.

Also, what percentage of the non-infected population sought care during the same time period? We don’t have anything to compare this to."
2021-06-15 11:20,This is an important story. But the study’s limitations should be made clear much earlier. Leaving out those insured through Medicaid and traditional Medicare misses a very large population.
2021-06-15 11:24,"It would be interesting to know if vaccinated people with ""breakthrough"" asymptomatic, mild, or moderate covid infections also develop these new conditions or if the vaccine protects them from ""long covid"".  Unfortunately, the CDC has stopped tracking all but serious breakthrough cases that lead to hospitalization or death.  Shouldn't the CDC want to know this?"
2021-06-15 11:28,"This quote ""Another limitation of the study is that it did not compare people who had Covid-19 with those who did not, making it unclear if rates of post-Covid symptoms were higher than in a more general population"" basically undermines the entire study."
2021-06-15 11:30,The lack of a Control group makes this study very irrelevant. I have never heard of a scientific study without a control group.
2021-06-15 11:31,"The hidden consequence of COVID 19 is extremely disturbing and anti-vaccination individuals need to take notice. This microbe is unpredictable and insidious.  I hope everyone get the shot and awakens to the perils of all types of infectious diseases.  Already, untimely morbidity and mortality of infectious disease leads all other causes of death and global efforts are inadequate regarding pathogenic microbes."
2021-06-15 11:32,"The most revealing part of this ""study"" that it analyzed not the actual medical data, but insurance claims. The conclusions are foregone and redundant to many other studies, involving actual medical histories, but the circumstance sheds light on the fragmented and chaotic healthcare ""system"" in US. The reason Pfizer sought health outcomes feedback on its vaccine administration from Israel, and not US is that Israel by and large has an integrated healthcare system that collects highly detailed and well regulated medical info. US doesn't have a healthcare system, instead we have a loose assortment of healthcare providers - mostly sellers, where medical help is dispensed not according to health needs but ability to pay. The most integrated health information space in our case are indeed the few major health insurance purveyors who collate the claims. Naturally outside accounting insurance claims represent what's called bad and noisy data: not only these claims exclude under- and uninsured people, the data-rich medical info collected by medical professionals is therein degraded into medical coding categories by personnel with no medical training. Instead of analysing blood test results, say, for high cholesterol, the study looks at the billing for the same..."
2021-06-15 11:35,"“People with long Covid need multidisciplinary care,” said Dr. Al-Aly, “and our health systems should adapt to this reality and develop capacity to deal with these patients.” All patients need this. Lyme disease, also an epidemic, has long highlighted the need for a multidisciplinary approach to medical care. Our healthcare system has been fragmented for a long time because we undervalue the primary care practitioners in our society as compared to the specialists."
2021-06-15 11:36,Then there are those of us coping with post Covid issues who do not have health care and therefore are not included in this study. And I’ll bet there are millions of us.
2021-06-15 11:37,"Correlation is not causation. Or maybe people are more conscious of their health or are being followed more closely by their physicians due to having covid and minor symptoms for which they wouldn’t normally have sought medical attention are being investigated and attributed to covid. Or maybe things with other causes are being attributed to covid due to time of onset. My husband did not have covid (tested weekly for much of the pandemic so we’re sure). He also started having smelling distortions during the pandemic. Because he was able to be adamant that he did not have covid at any point, his doctors explored other causes and it was most likely caused by damage during sinus surgery."
2021-06-15 11:38,"this article only shows more study needs to be done. Don't forget we are coming out of a very stressful year of Covid. People were isolated from each other. They gained weight, lost loved ones, worried every day, lost their jobs or worried about them, lost their homes too. People changed their lives, figuring out or trying to figure out how to survive differently. Places of employment changed, retail business changed. One would expect all sorts of symptoms to come out. 
I don't know how it can be known that those who are experiencing these symptoms are actually post-asymptomatic covid if they did not even know they were asymptomatic.
We need a universal health care system, one that would be better informed centrally about such long term issues."
2021-06-15 11:38,"Many of the reported conditions mimic those of fibromyalgia.  Brain fog, pain, fatigue are common problems for this syndrome.  A blood test for the Epstein-Barre marker confirm that."
2021-06-15 11:46,"I think a lot of this has to do with the stress of the days of covid. My doctors thought I had a very mild case of covid early but I couldn’t tested. I had no antibodies so it seems unlikely  that I did not have it. I’ve had severe weakness that lasted for weeks  I’ve been through a battery of tests, including MRIs but nothing. 

I now believe that it was anxiety and related issues have increased beyond measure since the beginning of the lockdown. Panic attacks create extreme weakness in my body that seem to take days to recovery from."
2021-06-15 11:47,"Infection is associated with the onset of certain autoimmune conditions, acting like a trigger. It will be interesting to see if Covid acts like that or something else is happening. In the meantime, I hope we can get everyone to take it seriously (unlikely, I know). And I hope we support people dealing with these outcomes at work, school and in medical care."
2021-06-15 11:54,"Association does not prove causality.  
During the pandemic we heard a lot about the importance of controlled studies, even though they delayed vaccine deployment by half a year, costing many lives.
This is de facto an uncontrolled study.  The appropriate control would be to lock up the planet for a year in a parallel universe and see how sick people become.
In this universe, appropriate control groups do not exist.  Simply using uninfected controls is not valid, since it is already established that many people delayed medical care, even for emergencies, because of the virus.  By contrast, there would be a follow up bias towards those who were infected."
2021-06-15 11:57,"There is an opportunity to place those that choose not to be vaccinated for non-health issues to be in a separate insurance pool.  Reprice the risk and cost for health, life and other insurance for employers."
2021-06-15 11:57,Doesn't the fact that the study didn't compare people who had Covid-19 with those who did not invalidate the results? Wouldn't you have to subtract the percentage of people without Covid who presented with new diagnoses during that period from those who had Covid to get a picture of the effect of the disease?
2021-06-15 12:01,"This study is so helpful, even without a control group, etc. I had covid 19 in April last year. While I haven’t been exactly struggling since then, I haven’t been thriving either. Having an explanation for some of what I’ve gone through this past year is soothing. It’s also a rallying cry to take better care of myself."
2021-06-15 12:02,"There should be or perhaps there are ongoing studies dealing with physical problems associated with after effects of the vaccinations.  I, personally, developed intensely painful sciatica within a month of receiving the Medina vaccine.  I had very severe symptoms after both doses of the vaccine.  I am still suffering with the sciatica 3 months  after the onset of the condition and now have to use a walker to get around.  Although I did have sciatica once before, it responded within a short time to the anti inflammatory medicine.  This time I had a course of the drugs 3 times with very little relief.  I continue to suffer with pain, which is a result of inflammation of the nerves in the spine and worry that the condition has now become chronic.  I do hope studies are being done tracking the possible after effects of the vaccines.  I am still happy that I received the vaccine even if it may have caused my present physical problem. At least the sciatica is not life threatening as the Covid 19 is."
2021-06-15 12:06,"For residents of senior living facilities,  more emphasis is needed on after effects.   They were targeted by  no restrictions on workers, either deliberate or unknowing.  For those patients who deliberately chose bad choices, such as no maskers,  I have no pity and expect them to pay the full cost of care needed.   Too many Americans are draining the tax dollars by making bad health choices.   Everyone should pay according to health vs bad health choices."
2021-06-15 12:08,"As to high blood pressure and cholesterol, it might just be that people had not those checked in a while and it was just a coincidence. Sometimes, people go years without knowing that they have either one or both."
2021-06-15 12:10,"Just to mention ""Many studies of long-haul COVID have been relatively small. The study thought to be the largest to date, which made use of US Department of Veterans Affairs national healthcare databases, involved 73,435 non-hospitalized patients with COVID-19 and 13,654 hospitalized patients with COVID-19, as well as approximately 5 million controls.""  

The VA electronic health records sytem is the finest tin the world.  It was almost completely the conceptualization of  product of GOVERNMENT EMPLOYEES   including my wife. 

It is a priceless national resource and the gold standard for the world."
2021-06-15 12:12,What lifestyle changes were people making during this time?  We’re they eating better or worse?  We’re they exercising more or less?  How much did stress have an impact.  I think it’s important to separate the actual virus from the changes we made because of the virus.
2021-06-15 12:16,Recently I learned that a doctor friend acquired post-covid diabetes.
2021-06-15 12:17,"many of the comments seem to dismiss the conclusions of the study and, indeed, more research is warranted. however, as I had a silent heart attack and my thyroid was damaged by a viral infection a number of years ago, I don't think the conclusions are unreasonable."
2021-06-15 12:17,"This is not useful information without a comparison group. I would wager that the stress of living through this past year, even in people without COVID, likely increased all the issues reported as being higher in people who tested positive for COVID, but we cannot know this for certain without more data."
2021-06-15 12:26,"I’m glad that the article mentioned limitations of the study, unfortunately the key limitation was not mentioned until the end.  That is the fact there was no matched control group that did not have Covid. Without a comparison group the reality is that a study like this has zero validity to determine anything about so called “long Covid”.  Any person that has any type of illness and recovers is more likely to see a physician in the months after their recovery. 
This would not be unique to Covid. Do we then call that “long pneumonia”, or “long Shingles”, etc.?  I am a GI doc in practice for 34 years, many patients who have acute gastroenteritis from food borne illness can have symptoms that last for several months after they have recovered. We don’t necessarily define this as a new illness. The other weakness is that the study was just based on insurance claims and not actual evaluation of the patients. This tells us nothing about long Covid. The patient may have been seen for back pain, a cold, etc, things that have absolutely nothing to do with their preceding Covid infection. Whether long Covid even exists is debated by many physicians. It requires actual Scientific study to determine whether it is a real entity or not.  This study does nothing to help with that, in my opinion. It is however going to result in millions of patients  going to their Doctor convinced that every minor symptom they have going forward is due to “long Covid”. That is highly unlikely."
2021-06-15 12:27,"A similar study needs to be done for post-vaccine health complications. I know of one woman who suffered a blood clot that nearly reached her heart two days after her vaccine- otherwise extremely healthy 65 yo woman with no history of heart or vascular issues. And, another young woman (28) whose eosinophil levels (a white blood cell) were discovered to be 3000  to 6000(normal is under 500) after she suffered from an outbreak of hives after being vaccinated. Considering how the immune systems went wild in COVID patients, attacking organs, causing death, a closer look at why these eosinophils are so high post vaccine is warranted. Granted, may be another cause, but again, an otherwise totally healthy young woman with a sudden health complication."
2021-06-15 12:30,"I was diagnosed with post-Covid reactive arthritis. The virus attacked my brachial plexus nerves in my chest which were damaged during a bypass surgery over a year ago. I have no sense of feeling in my hands most of the time. In addition, Covid reactivated an old vertebral injury, leaving me with excruciating leg pain. Long Covid is very real."
2021-06-15 12:30,"Reading the comments, it seems that no one wants to hear this disturbing new information that even a mild case can have long-term consequences. Everyone wants to get back to normal, but it's important to understand that the pandemic isn't really over."
2021-06-15 12:31,"This study tracks the Va study published in Nature 

Epidemiology is not done in a single study.  each study adds to the overall picture."
2021-06-15 12:32,"There are long covid studies have been done in a  controlled manner (though smaller, including one  by Al-Aly referenced in this article). So you have take it comprehensively: you look at the symptoms of long covid in the controlled studies and then you can use this as an engineering exercise: if most common side effect of ibuprofen is reported to be stomach aches (say) based on the RCT data, and you now have a new sample of ibuprofen people who  have the same side effect, you can draw some logical conclusions from there."
2021-06-15 12:36,"From the Nature Study Referenced in this study 


""Beyond the first 30 days of illness, individuals with COVID-19 had an increased risk of death (hazard ratio of 1.59 (1.46–1.73)). We also estimated the adjusted excess burden of death due to COVID-19 per 1,000 persons at 6 months on the basis of the difference between the estimated incidence rate in individuals with COVID-19 and all VHA users. The excess death was estimated at 8.39 (7.09–9.58) per 1,000 patients with COVID-19 at 6 months. Individuals with COVID-19 had a higher risk of requiring outpatient care (hazard ratio of 1.20 (1.19–1.21)), at an excess burden of 33.22 (30.89–35.58; all excess burdens are given per 1,000 patients with COVID-19 at 6 months) and at a greater frequency of 0.47 (0.44–0.49) additional encounters every 30 days (Extended Data Table 2b, c).""

This provides a usable control group for the larger study referenced here."
2021-06-15 12:45,"Historically, there were thousands of a disease ""Moebius Encephalitis"" in the time period 1920-1930. The sufferers would fall asleep while sitting and talking or eating. As far as I am aware, the Moebius Encephalitis sufferers all died. 

Some believe that this was a result of  the ""Spanish Flu"" epidemic of 1918. So such reports should not be a very big surprise. The question is how to treat these cases."
2021-06-15 12:46,"I wonder if some of this could be PTSD.

I have not had Covid, but I do have fibromyalgia, and I have a lot of these symptoms.  I also have C-PTSD, and one theory is that the fibromyalgia arose from that."
2021-06-15 12:46,"What about those of us who never had COVID, but now suffer anxiety and depression after being vaccinated?"
