Date,Comments
2021-06-07 23:26,"“How” – from this articles title

My concern is that scientists are so busy watching the (What) of these variants that an important question is being largely overlooked. 

The question I would like to see addressed is the probability of this virus mutating in a continually more effective pattern that always seems to focus on the spike proteins rather than any other protein or portion of the virus. And why are all the spike protein mutations in the direction of a more contagious virus?

““It’s very impressive,”- from this article

There should be a way for scientists to calculate some given odds of any protein shuffling of the virus deck, and whether these rapid and effective (for increased transmission and illness) changes are within mathematical probabilities. Some scientists have shown surprise in a few articles. 

We were told when all of this began that pandemic viruses historically have diminished in form to much less serious contagions and yet this virus continually makes all the right moves in its favor, and so why is there not more suspicion of the (How).

Couldn’t the (How) be an important part of considering whether this virus is Lab constructed or not? Is the protein shuffling act by this virus beating the odds by a thousand to one- a million to one? The scientists must have some idea regarding the odds, and that is what we need to know rather than not asking deeper questions."
2021-06-07 23:55,"Thanks, Mr. Zimmer, for this article. You have a great ability for conveying complex material in a clear and concise manner. 
You have made the important note toward the end of the article that infection with the virus confers a more complex and possibly more thorough immune response."
2021-06-08 1:34,"I'm not a medical person but it's been known for some time that COVID sabotages the roll-out of the innate immune system by disrupting the production of interferon (which, as I understand it, is produced by cells that are in the process of being taken over by the virus and among, other things, ""warns"" neighboring cells to take protective measures.)

So the issue is not that this new variant inhibits the production of interferon, but it does so more effectively.

What I'm still trying to understand is how this produces a catastrophic failure in the ability of the adaptive system (Lymphocytes, especially T-cells) to respond appropriately. You see this in the patient characteristics tables where the overall number of Lymphocytes is below minimum, and the CD4 T-cells (the real brains of the immune system) and CD8 T-cells (""killer T-cells"") are way below minimum.

The big problem with COVID is that people with serious cases have steadily diminishing Lymphocyte numbers which means that the ""killer T-cells"" that would normally clear a virus are themselves killed or their production is being down-regulated. 

The result is that the virus essentially multiplies unimpeded and proceeds to infect every organ in sight and you end up with a vast range of problems in the heart, lungs, other major organs.

Anyway, good research.  Hopefully, we'll see something about the Interferon/T-cell connection."
2021-06-08 1:37,"Evolution is wonderful. In antagonistic interactions like parasitism and pathogenic disease there is an arms race between a new pathogen and a host immune system. Vertebrates like humans have evolved a sophisticated adaptive immune system to counter the onslaught of new and old pathogens. 

This immune system acts by intensifying natural selection on pathogens, just like antibiotics creates a new selective environment that bacteria cannot escape. Of course, bacteria generate millions of new random mutations, most of which don’t provide bacteria with resistance to the antibiotic. But it only takes 1 mutation out of millions that permits the bacteria with the mutation to survive and reproduce a resistant strain that forms all new bacterial populations.

Our adaptive immune system acts like the antibiotic, making life difficult for a new virus. But, all it takes is 1 new mutation out of billions to create a new mutant virus that allows it to escape part of the immune response. Viruses with the mutation dominate future viral populations. This, in turn, creates a new source of natural selection on our adaptive immune system to respond with a mutation of its own. Hence, after a week, the immune system can overcome the new virus interferon suppressing mutation. Unfortunately, that extra week gives the virus an advantage to reproduce and harm us. This back and forth is an evolutionary arms race."
2021-06-08 6:14,"If a virus can do what this article says it can, then viruses are smarter than we are, in their own unique way.

No, I am not saying that viruses can compose a symphony or write a Shakespearean play, I am saying that its wiliness transcends and exceeds that of the human brain, and as such, within its own realm of specialty, it is a lot smarter than us.

And when you think about it, it should not come as a surprise, because from an evolutionary point of view, viruses have been around a lot longer than we human beings.

Is there a lesson here for us to learn? Yes there is, and that lesson is that we all need each other to take care of each other, and the way humanity has been heading for centuries, war after endless war, including civil and domestic wars, unless we learn from viruses, we are doomed.

That is what they are teaching us."
2021-06-08 9:18,Where and when does it end.  I am already vaccinated with Moderna but do i want to get jabbed every time a new variant is discovered.  These new discoveries just give more ammunition to the anti-vaxxers or the vaccine hesitant to forego any vaccination.
2021-06-08 7:03,"For most they are starting to get back to normal, in six months they won’t give Covid 19 and all it’s mutations a second thought. They don’t read articles like this, scientific journals, studies of any kind. It’s tragic. This was just a glitch, yes millions have died and it’s absolutely heartbreaking. Thankfully our brilliant scientists and medical professionals have been exceptional in their expediency and we have several vaccinations that appear to be working, currently. We have all lived through now and witnessed the utterly devastating impact economically, socially and physically this has had on society and now our lives. It brought us to our knees and the recovery is ongoing. Perhaps the next “virus” won’t be as kind, 10x more virulent, 20x deadlier and it’s mutations and ability to adapt beyond our understanding. It could potentially finish us as a species. Hubris and Arrogance and a Covid x 10 will be our faith unless we change and come to our senses. I’m not sure or confident we can."
2021-06-08 3:56,"so, how effective is the lower-efficacy J&J vaccine against this and other variants that will result from the failure of certain groups to get vaccinated or wear a mask indoors? [By ""certain groups"", I'm of course referring to Donald ""Tantrum"" Trump supporters.] 

We'll never know, since the CDC no longer tracks the spread of COVID 19, outside of select groups of people. And that can't be attributed to former president Trump."
2021-06-07 22:10,"Many, many, many thanks for this technical update. Like many other reports published in NYT, it will take multiple readings to grasp its significance.

But again, many thanks."
2021-06-08 11:57,"I am looking at: ""But studies on people who recover naturally from Covid-19 have shown that their immune systems learn to recognize other viral proteins, including Orf9b"" 

... and I have been fully vaccinated. 

Is there any way I could get unvaccinated ? :-)"
2021-06-08 13:30,"but the fact that so many vicious variants have emerged all over the world suggests to me that the lab leak theory is weak, 
of course, the world needs to investigate what happened in Wuhan, (although I expect China to have destroyed or manufactured evidence against the lab leak theory, if at all true ) - the world needs to investigate the Wuhan origin by tracing the mutations back in samples to the origin."
2021-06-08 13:14,"Seems we have known this for a while, no? 

<a href=""https://www.pasteur.fr/en/home/press-area/press-documents/team-international-scientists-identify-common-vulnerabilities-across-sars-cov-2-sars-cov-1-and-mers"" target=""_blank"">https://www.pasteur.fr/en/home/press-area/press-documents/team-international-scientists-identify-common-vulnerabilities-across-sars-cov-2-sars-cov-1-and-mers</a>"
2021-06-08 13:15,There is little chance that variants will not keep cropping up given that most of the world's population has not been vaccinated.
2021-06-08 6:16,"Thank you! Articles like this are why I still read the Times. 

I wish the Editors would put more effort into reporting that leaves readers with deeper insight into the facts, and less effort into trying to fit natural disasters, diseases and wars into their racial, gender and colonial narratives."
2021-06-07 21:39,"Our biggest problem is the US isn't reporting people getting infected after getting vaccinated. The news keeps saying nobody vaccinated had died. This is not true and wasn't going to be possible. Remember if you have cancer or any extreme immune system problem, test show that you can stillhave little to no antibodies to protect you after you are vaccinated. You still need to wear a mask. The vaccinated need to have their infections reported instead of pretending like they don't exist, because they can spread disease. It gives everyone a false believe that there is less covid out there than there is.

Everyone should keep in mind, the reputable sites such as 
medical professionals reporting side effects from vaccines:

<a href=""https://www.medscape.com/sites/public/covid-19/vaccine-insights/how-concerned-are-you-about-vaccine-related-adverse-events"" target=""_blank"">https://www.medscape.com/sites/public/covid-19/vaccine-insights/how-concerned-are-you-about-vaccine-related-adverse-events</a>

The MAYO Clinic users reporting side effects:
<a href=""https://connect.mayoclinic.org/discussion/covid-vaccines-and-neuropathy/?pg=58#chv4-comment-stream-header"" target=""_blank"">https://connect.mayoclinic.org/discussion/covid-vaccines-and-neuropathy/?pg=58#chv4-comment-stream-header</a>

And most importantly openvaers.com
An all drugs side effects database where doctors and nurses write in with what happend to their patients."
2021-06-08 2:47,This is exactly why those who choose not the get the free vaccine are UnAmerican.  We’re all in this fight together.  Vaccine-dodgers seem to only care about themselves.
2021-06-03 16:08,An inspiring and sobering story. The world is blessed that he was able to survive this terrible disease and now will amazingly be able to help patients even more than before.
2021-06-03 16:11,"Great recovery story.  

This is how we want people to come back; ready to make the most of the life they almost lost.

Every doctor should read this.  Too many think they will never be a patient, and that they will sail through it and the forget that it happened.

This man is probably aware that the damage he experienced will affect his future.  I don't have to tell him why.  He knows the statistics.  That knowledge can flatten people.

And yet, he is able to do the best possible thing for a skilled provider: share the knowledge and prepare to hand the torch on.  

If you aren't a medical professional, remember the part about where his arm was still damaged from the positioning.  It still might be.  They left out how much came back.  

The team cared for him as one of their own, BECAUSE HE WAS.  And he still ended up with damage.  Do your best to stay out of the hospital to avoid this kind of damage.  Imagine if you could never walk up stairs again, or pull up your underwear.  You lived.  You just didn't get back 100%."
2021-06-03 16:13,"Incredible resilience. Four weeks is a long time to be on a ventilator, his team of physical therapists must have worked hard to get him back to walking and functioning independently."
2021-06-03 16:14,"I worked with Dr. Kato early in my career in psychiatry--""Michael Jordan"" is right. He is a brilliant surgeon with a kind heart, just an incredible person.  I am so glad to hear he is on the mend."
2021-06-03 16:19,"Thanks a lot for writing this. Incredible. Glad to have Dr. Kato back and continue his work of saving more lives. 

Everyone - get vaccinated, that is all I can say."
2021-06-03 16:23,All the best to this remarkable and compassionate professional!
2021-06-03 16:27,"Dr. Kato, We are all lucky you survived.  Here is wishing that you can accelerate your work by training as many others as you can.  I can visualize a world where many other surgeons are doing what you do.  Thank you for all you do."
2021-06-03 16:33,"I will always feel guilty that we went along with doctors' advice and encouraged my mother-in-law to have a feeding tube at the end of her life.  The surgeon who inserted it was clearly just doing his job and was otherwise indifferent to what it would actually be like for her.  The tube ended up causing much suffering without making feeding or medication-taking any easier.

So I think that perhaps doctors in training ~ students and residents ~ should have doctors who have been patients talk to them and really make them feel what it's like to have to go through procedures."
2021-06-03 16:37,"Wow.....what an amazing humble humane empathetic inspiring story that gives faith in the better angels of our nature.

Feeling, hearing, seeing, tasting and touching the world through another's shared experiences is awesome."
2021-06-03 16:38,"Reading this article reminds me of our celebrity culture, where ""celebrity"" is an actor, a reality show people, athletes, questionably talented artists of all venues; and here is a true celebrity, a true hero: Dr. Kato. Sometimes I'll read in the NYTimes obituaries about Nobel Prize winners, whom I had never heard of, because they weren't ""celebrities""; yet in some case they were responsible for saving millions of lives, others changing millions of lives for the better. What a strange country we are, where Donald Trump becomes president yet nobody knows, until now, who Dr. Kato is. We need to be educated about true heroes, not celebrities..."
2021-06-03 16:39,"Thank you Dr. Pereira and ALL the professionals, like nurses,  at your hospital for saving Dr. Kato. Saving him will save so many others. My son is a transplant recipient so I really appreciate skilled professionals. Dr. Kato, as you meet others, be sure to pass on your ""aha moment"" that you must train others to take your place. Time catches up with everyone eventually, it doesn't have to be Covid."
2021-06-03 16:39,Really shifts the urgency to share Kato's undeniable talents but also in how we approach patients in the medical field. Sometimes textbooks cannot teach everything. Thank you.
2021-06-03 16:39,"Thank you for sharing this story of COVID-19 and recovery. He sounds like an incredible doctor.  I was moved, toward the end, that he realized that he has to recruit others to do the work in Latin America so that it will continue. What a devoted, thoughtful man. And what a thoughtful writer to include that detail."
2021-06-03 16:40,"This truly was a great read, about a remarkable person. And a friendly reminder: despite his superb physical condition, age and expertise, he very nearly died. Death comes for us all, and often it’s a matter of luck.  Good and bad. The best that we can do is to ameliorate the Risks, for everyone.
   Best Wishes, Doctor."
2021-06-03 16:51,"I am glad Dr Kato’s hospital reasonably 
accommodated him while he recovered (using a stool, ramping up to more complex cases etc) Not all hospitals are that generous."
2021-06-03 16:58,What a wonderful triumph for an exceptional person.
2021-06-03 16:59,Thanks for a terrific story. And congratulations to Dr. Kato and his colleagues on his recovery. Long may his empathy for patients resonate.
2021-06-03 17:01,Dr Kato performed a 12 hour operation on my husband in 2015 that added many years to my husband's life.  No other doctor would attempt the surgery.  He was a compassionate man then and now has the added knowledge of what it is like to be in the hospital and the ICU for weeks on end.  I hope that surgeons line up by the dozens to learn from him so that many more people can benefit from these life saving surgeries.  Welcome back Dr Kato!  And please get vaccinated everyone.
2021-06-03 17:04,"This story reminds me of the movie The Doctor, from 1991 starring William Hurt.  Although doctors must remain detached from their patients in order to not become overly emotional, it is valuable for them to experience the hospital system as a patient.  Not to mention the staggering cost of such a visit, in both pain and suffering but also the monetary cost."
2021-06-03 17:04,An inspiring and emotional article! This doctor was already a superhero but the empathy that grew from this ordeal was an additional gift to his future patients and the doctors he will continue to train.                                                                                          The inserted videos were touching. Thank you NYT.
2021-06-03 17:09,What a touching and inspiring story! I love the video too. Go Dr. Kato and team that cared for him. How wonderful it is that he will be able to train the next generation of surgeons and continue the work of his foundation. Go Dr. Kato!
2021-06-03 17:10,Great story of the severity of covid and a miraculous recovery. People who think it’s no worse than the flu should read this.
2021-06-03 17:10,"Truly heartwarming to hear that Dr. Kato has recovered - he has so much more to give.  The efforts of the staff to save him are commendable - saving his life will save many others.  As a physician, I faced a series of serious illnesses and surgeries when I was in my early 50's.  I learned so much about being a better doctor by being a patient.  There is a vulnerability as a patient that you do not feel on the other end as physician.  We all know about empathy, but it is magnified when it happens to you.  And I'll never voluntarily eat Jello again."
2021-06-03 17:14,"It really is eye-opening to see medical care from the other side of the table. I'm so glad this doctor survived, for a whole host of reasons. I wrote a book called, ""What Patients Want: Anecdotes and Advice."" I wrote that ""doctors"" and ""patients"" are not  mutually exclusive terms, as this article verifies. Best of luck to this doctor and his patients."
2021-06-03 17:15,"A truly inspiring, brilliant surgeon and it's so wonderful that he has been able to go back to operating and helping others.  

Godspeed Dr. Kato on your 2nd chance at life."
2021-06-03 17:15,"Today I asked a medical provider in a PT office in Connecticut if they were vaccinated and the answer was no. Reading this article, I simply cannot fathom why vaccination is not mandatory, like with measles or polio, or how anyone could refuse vaccination. For my part, I’m choosing another healthcare provider."
2021-06-03 17:20,"What a wonderful & relevant human interest story.  Great writing by Denise Grady. It brought tears to my eyes as I followed along, and I happy to hear this great surgeon is able to share his innovations and training."
2021-06-03 17:21,"My cousin survived Covid last month, via an ECMO machine. It was a horrible experience, and she has a long road to recovery. She, like this doctor and many others, have new-found empathy for people who go through horrible medical situations. I'm glad the doctor is on the mend and sharing this message.

My cousin did an interview with the CBC encouraging people to get vaccinated and of course, there were haters who commented. Lucky for her, being in Canada, she doesn't have to worry about insurance bills pouring in over the next year. She can focus on her recovery."
2021-06-03 17:28,"As someone who had the fortune of working with Dr. Kato many years ago, I can attest to the level of respect and awe that he deservedly experienced at NYP.  A gentle, compassionate man who was also a rock star! I’m so sorry for what he went through and so grateful that he was so expertly and carefully treated at one of the best hospitals in the country, so that he could return back to his gifts and talents. Thank you for being brave enough to share your story, Dr. Kato and thank you for all that you have contributed to the lives of your patients and colleagues."
2021-06-03 17:31,"Dr. Kato seems like one of the rare ""superstar"" surgeons who actually has sympathy and a sense of understanding of how difficult being a patient is.

Now, he has empathy and more data points to guide him and his team in being an even better doctor (though he sounds pretty fantastic).

I also admire his desire to make the most of the time on earth he has been gifted by his colleagues.

Also, as others note:  PLEASE everyone get your vaccines (especially those bizarre few reluctant nurses and doctors ou there)."
2021-06-03 17:35,"This reading reminded me of a poem read years ago and committed to memory.  I don't recall the author.

""RESILIENCY is a key factor in living. The winds of life may bend us. But, with resilience of spirit, those winds cannot break us. 
To courageously straighten again, after our heads have been bowed by defeat, disappointment and suffering, is the true test of character."""
2021-06-03 18:04,"As a physician myself I would hope that it wouldn't take their suffering a serious illness to appreciate what patients have to go through.

As to Dr. Kato, you might have mentioned a couple of advantages he had over other most patients.  He is paid a very high salary so didn't have to worry about being out of work for an extended period nor did he have to worry about medical bills as no doubt anything his insurance company didn't cover his hospital forgave.

Maybe in addition to advocating for better tasting food he might also consider advocating for everyone to be able to receive quality medical care without have to worry about being bankrupted by it.  That would show he really has an understanding about what many patients have to endure."
2021-06-03 18:07,"Wow.  Well done, Dr. Kato and the army of supportive colleagues.
I had my own experience, very much like Dr. Kato's a few years ago.   Definitely changed my perspective in many positive ways.

He will never be the same doctor again; he will be better."
2021-06-03 18:10,"May Dr. Kato continue to thrive and, as part of that, may his experience be used  to teach other doctors what it means to be the patient. An electrophysiologist observed in one visit that I'd used what to him seemed like a lot of office time.

His comment was humiliating. I moved to an excellent Boston practice, with an electrophysioligist who immediately revised (and restructured) my care plan and, gosh, I seldom see him. That's because he listened and responded.

But, returning to this article, I'm truly happy to hear that Dr. Kato survived Covid. I hope there's another marathon ahead, this one with running shoes.😊"
2021-06-03 18:14,"Patient/doctors like the amazing Dr. Kato, should, as he seems to want to, be using their experiences and knowledge to help optimize health care, incorporating both the patient experience and the expert medical/surgical knowhow.

Dr. Kato will of course touch individuals he directly teaches and treats.

Hopefully also, there are other platforms that enable his multi-directional perspective and expertise to be very widely shared and used for education of doctors, nurses and hospitals (including the many not in direct contact with him).   Certainly there must be other exceptionally competent medical professionals like him, who have deeply experienced both the patient and medical delivery side.  All of them should be continually searched for and helped to engage with platforms that maximize the distribution of their invaluable experiences and knowledge."
2021-06-03 18:15,This is one of the most inspiring stories i have read so far from the NYT this year. I don't think you'll find another surgeon like Dr Kato who is so magnanimous and yet possesses so much leadership and fortitude. Kudos to Dr Emond for recruiting such once in a lifetime talent!
2021-06-03 18:15,"Dr. Kato performed an ex-vivo operation on my colleague’s wife, when no other doctor would touch her. He gave her many more years of high-quality life before she finally succumbed to her disease. 
We are so lucky to have him well and back to doing what he does best."
2021-06-03 18:19,"Fantastic story! Inspiring for all of us. He must be such a great person. Thank you, NYT, for carrying the story."
2021-06-03 18:22,"Dr. Kato is welcomed to the society of the people who got near the precipice but did not fall. As a child I was very sick for a time and almost died. The last memory I have before a life saving surgery is that of falling down a precipice. 
I think there is a common feeling that people who have been in that situation share. It is gratitude for the opportunity you have to go ahead with a life. But there is also the fear you experienced and that will never be erased from your mind. Reading of Dr. Kato's experience brought tears to my eyes. May he live a long and very happy life. May he have peace. May the terrible experience be erased from his mind, except for that solidarity he now has with his suffering patients."
2021-06-03 16:26,So happy to hear Dr Kato has recovered and is back at it!
2021-06-03 16:58,"Click on the link ""he went home"" and view the video on the hospital's page of his release. Very moving."
2021-06-03 17:34,His humility is what touched me the most.
