Date,Comments
2021-06-09 17:17,This is way overhyped. The infection rate in China is way lower than the US and you don’t hear about some new catastrophe unfolding. It is funny that my family was super worried about me in Hong Kong from watching the news until I showed them the numbers. China and HK tend to overreact to even a whiff of COVID. That doesn’t remain the situation is out of hand. They have a formula that worked and even if it is overkill they will keep using it until they are 100% confident in alternatives.
2021-06-09 17:21,"What is the point of this article? it vacillates all over the place and tells nothing new. It uses scare tactics about one dose vaccinations. He talks about Guangzhou's ""pandemic supplies"" when they have 157 people in the hospital!  
     I have regular contacts in China  and speak weekly.  Life is for the most part and for the majority of Chinese, completely open and safe there. Over 15 million people a day are getting vaccinated with vaccines that are comparable to our Johnson and Johnson vaccine.  For the most part the people have a choice in China which vaccine they take. You can simply walk over to a local hospital or clinic, which are all over the place and get your vaccine. The only people who can travel into China right now are Chinese citizens, special visa holders who are mostly business people who have serious business interests there with listed companies, and permanent residents. They have to quarantine for two weeks upon arrival which is the same as the US was doing up to now. People wear masks when they go to the large train hubs, airports, etc. but locally they don't. There is no national mask mandate. When the government locates an outbreak, they immediately shut down an area, isolate and test. Standard procedure. By September the US and China both will have this Covid situation done. Look for a mutual opening up soon after. We are becoming safer and safer by the day and China is the safest country in the world with Covid."
2021-06-09 17:22,"The part that I don't understand is why the anal swabs, unless Corona Virus survives digestion?"
2021-06-09 17:25,"I thought only 4K people died there. It was in the NYT last week. Lots of comments of how bad it was in the US and how well other countries managed this. Perhaps the truth will start to come out. IMO China engineered this virus, somehow it escaped and they are now suffering like the rest of us. Lock downs. How 2020 of them"
2021-06-09 17:28,"“ By Tuesday, Guangdong Province had 157 people in hospital with the virus and was announcing about 10 new cases per day. The province and also Guangzhou itself have banned anyone since last weekend from leaving unless they have a valid reason and a negative nucleic acid test for the virus within the preceding 48 hours.”

SC has 250 cases per day with population of 5 million. Guangdong population is 115 million  10 cases per day and they are restricted. We are totally unrestricted in US. 

Time will tell which superpower is super."
2021-06-09 17:45,The present China COVID-19 case upsurge should be a lesson for our folks who are adamantly against COVID-19 vaccination. These vaccines are quite efficacious.
2021-06-09 17:48,"I want to publicly thank God (insert your deity's name here) that I received 2 Moderna shots.  My only cost was the $1 disabled bus pass cost and a walk up a ""steep incline"".  I received my 2 shots in the office of a infectious disease specialist that I had not seen in about a decade and it felt like a family reunion.  I was never in a room with more than 2 people (counting myself).  

And I had a wonderful side effect from my first shot.  Since that first jab, I no longer get up 2-3 times every night to use the restroom like I have for the past few years now.  

And the sun in shining (currently) in Seattle.  

Again, thank you God Almighty (insert your deity's name here).  

(And thank you former President Trump, President Biden, Governor Inslee, and Mayor Durkan for Operation Warp Speed and getting vaccines to me with no cost other than my $1 bus ride.  Ain't America Great!!)"
2021-06-09 17:53,"Seems like the Chinese made vaccines are very poorly made. America got COVID under control, look at China right now. And they want to be a superpower?"
2021-06-09 18:02,"If businesses are worried, they can do their part to get everyone vaccinated by offering incentives (carrot) and requiring proof of vaccination for employees and, in some cases, customers (stick). So much hand wringing, so little action. They’ll reap what they sow."
2021-06-09 18:09,"China will host the Winter Olympics in February and Japan will host the Summer Olympics in July.

More than 2.22 billion vaccine doses have been administered worldwide which only equals 29 doses for every 100 people. There is already a stark gap between vaccination programs in different countries, with some yet to report a single dose.

Parts of Britain have decided to extend lockdown restrictions because of the spread of a new, highly contagious variant first detected in India known as Delta.   This past week, the government tightened its travel rules, including for the fully vaccinated.

With all that being said, I tend to read and pay attention whenever another outbreak occurs, especially when it involves a highly contagious variant.

This notion that being fully vaccinated will definitely keep me safe from harm is ludicrous, especially at my ever increasing senior age.

There isn't a medical professional I know who strongly believe that this no mask, continue to meet in large groups is dangerous and this virus will return with a variant vengeance down the road. No one is our of the woods yet.

Thank you for reporting this information.

Good luck to the residents of Guangzhou and to the medical professionals testing and caring for them."
2021-06-09 17:59,China should have controlled the experiments in their labs better.
2021-06-09 18:27,That poor German dude.
2021-06-09 18:37,"It seems some commentators here do not know that Mongolia is an independent country to the north of China, not part of China at all. 

I find Western companies’ complaints about the quarantine policies unreasonable. Do they prefer that China has an outbreak like the one India has suffered? Or do they prefer to put up with some inconvenience?

Taiwan and Australia also require visitors to quarantine for 2 weeks in government assigned hotels. I have yet to read complaints about that on New York Times."
2021-06-09 18:39,"This  news is very significant and ominous for America.  The consequences of opening up America before we all are immunized is unknown.  I call this reopening The Great American Experiment.   The Experiment will either end happily proving that measures taken to date to stop the spread of Covid 19 have been successful (no new wave of infections) or unhappily with a large number of people getting sick and acquiring their antibodies from the virus as opposed to acquiring   their immunity with the vaccine.    To see if the Experiment is over, we will need to study the numbers a few weeks after Labor Day.   I am still going to wear a mask in all public places and will still avoid all crowds until  the Great American Experiment is over"
2021-06-09 18:46,"They created it, then they hid it, they jailed whistle blowers and caused their deaths, then they denied it. They came out with a vaccine extremely quickly ( what a coincidence ) which is relatively useless and on top of that , are blaming every other country for infecting them ! Businesses that are worried, should be. We should be bringing as much manufacturing of especially vital industries back to North America. Relying on the CCP for truth is a fantasy."
2021-06-09 18:52,"""The latest cases have been found in Guangzhou, capital of the southern province of Guangdong. The authorities have blamed the Delta variant, which has caused widespread loss of life in India.""    
   China can blame any country for the corona variants but everyone knows that the original virus started in Wuhan, China. 
    According to a research paper by British professor Angus Dalgleish and Norwegian scientist Dr Birger Sorensen published recently, the SARS-CoV-2 virus has no ""credible natural ancestor"" and was created by Chinese scientists who were working on a 'Gain of Function' project in a Wuhan lab.
    The Chinese-created virus has caused havoc throughout the world, millions of people are dead worldwide and millions are still suffering and the economic loss is insurmountable.
   The Chinese thought they have got this monster virus under control but new variants of the coronavirus are appearing all the time and even the Chinese-made vaccines cannot stop them.
   In Mongolia, more than half of the population is fully vaccinated with the Chinese vaccine  ""sinopharm"" but the Coronavirus cases are surging in Mongolia prompting a new focus on the effectiveness of this Chinese-made vaccine."
2021-06-09 18:57,"I wonder if the German guy is exaggerating his bad experience for the media.  There is no shortage of youtude videos about quarantine experience in China after flying from high risk countries.  Nothing as drastic as the person was talking about...

.. blood drawn twice a day, six throat swabs, four nasal swabs and two anal swabs daily ... room had no towels, no toilet paper and no television, and the bed was a steel plate with a thin mat...."
2021-06-09 18:58,If that’s how they treat tourists imagine how they treat the Uyghurs
2021-06-09 18:58,"Apparently, the little rights and freedoms accorded to its people (and maybe even its big businesses) by the Chinese government has its positives, e.g. the relatively short duration of China's Covid-19 outbreak crisis. About 16 months ago, I watched in amusement TV images of some citizens being literally dragged (one or two invertedly!) back into their residences to help contain virus transmission. ...
     
Today, with the temporary exception of India, Canada’s government allows non-essential air travel to and from Covid-19 devastated nations, notably Brazil. While the airlines benefit from continued ticket sales, I’d venture there’s little or no public interest in permitting such unnecessary air travel. It does, however, create further risk of Covid-19 variant importation.
  
I believe that when the coronavirus crisis began, big business was the most influential voice to have the ear of government, when it should have been the independent health-sciences community. The result was resistance against an immediate halt in non-essential travel, including international flights — weeks of delay that may have translated into many additional and needless COVID-19 deaths. 

I've heard many people ask why there are/were travel restrictions on car trips in Canada while international flights are/were basically unhindered? I say, perhaps that’s because car travelers, unlike the airlines, don’t have very potent lobbyists in the nation’s capital, a.k.a. Parliament Hill."
2021-06-09 19:04,"OK. This reinforces my concern that ""reopening"" everything *might* be premature.

Especially in counties where those who worship failed former president Donald ""Tantrump"" reside. Bless their hearts."
2021-06-09 19:06,"I hope China experiences extreme pain and anguish for what they've done. Their poor lifestyle costs the world time and again with each new pandemic. The authoritarian way they run their country does them no favors. If you hated Trump, you should hate China five times as much and should be even more vocal about their atrocities. The entire world should turn their back on China, and take measures to ensure things like this never happen again."
2021-06-09 19:12,I visited with a friend a couple of days ago who live a few hundred miles west of Guangzhou.  There is an outbreak there as well.  He told me that people over 60 can't get the vaccine yet.  The government wants workers to get jabbed first.
2021-06-09 19:23,"This has pobably already been said, but these Covid variants are why I continue to wear a mask out in public even though I've been fully vaccinated. That, and the fact wearing a mask makes some Republicans angry kinda makes it enjoyable."
2021-06-09 19:25,"Does anybody really believe that China had things under control, as opposed to just clamping down on information?"
2021-06-09 19:30,"That's odd. If I recall, last year, according to the liberal media, China successfully beat covid and had only a few thousand fatalities, unlike Trump, the ""failure."" Our media know that this is true because the Chinese government told them so, and the Chinese government would never, ever lie. Trump said they were liars but we know thanks to our media that Trump was never, ever right about anything."
2021-06-09 19:30,"People should take news coming out of China with a grain of salt, both good and bad. Information about covid and variants gets revised constantly due to how little we know yet, and anyone who thinks the Chinese government is fully transparent with policy and numbers is simply naive. But that cuts both ways, predicting Chinese disaster is also highly speculative in a paucity of reliable information."
2021-06-09 19:35,"<a href=""http://www.xinhuanet.com/english/2021-06/09/c_139998507.htm"" target=""_blank"">http://www.xinhuanet.com/english/2021-06/09/c_139998507.htm</a>

June 9, 2021

Over 800 mln COVID-19 vaccine doses administered across China

More than 800 mln doses of COVID-19 vaccines have been administered in China as of Tuesday as the country steps up its inoculation drive.

A total of 808.96 million doses of COVID-19 vaccines have been administered, according to the National Health Commission (NHC) on Wednesday.

At least 70 percent of the target population in China is expected to be vaccinated against COVID-19 by the end of this year, said Zeng Yixin, deputy head of the NHC, during a recent interview with Xinhua.

[ Domestically, about 20 million doses of 5 Chinese vaccines are now being administered daily. Internationally, more than 350 million doses of Chinese vaccines have been distributed. ]"
2021-06-09 19:50,"Hate to say this, but we have states and rural pockets where very few people are vaccinated. Or people who are partially vaccinated — only one of the set of two or had COVID, think that suffices.

Then there are the little ones not vaccinated yet. And the UK is finding out about the one variant they have and young people getting sick now.

We have a tenuous, temporary COVID reprieve. 

Add underlying medical issues and geriatric persons in household. Yes, we’re still masking when in enclosed spaces."
2021-06-09 19:44,"I am as much a critic of the totalitarian regime in China as anyone, but this has a whiff of the classic American desire to declare victory - in keeping with the finest tradition of Trump’s Commerce Secretary Wilbur Ross saying - on January 31, 2020 - the pandemic in China will be great for the US economy. It seems after over a year of bungling, some Americans just need some news to tell them that America has “won” the epidemic after all."
2021-06-09 20:11,"My real concern is that even in Illinois, we are just now edging above the 50% level, and the daily doses are dropping.

That might be slightly reflective of downstate, which tends to be more GOP, but I really think it is just mostly boredom and the ""I'm feeling OK, why should I bother?""."
2021-06-09 19:53,Those foreign businesses would be better off in America here even with Biden's anti-business slant.
2021-06-09 20:06,"Dr. Marty Makary has sold his snake oil and declared ""natural immunity"" multiple times starting in Feb on WSJ opinion. Even worse, Dr. Jay Bhattacharya, a native of India, made GBD or natural immunity without vaccine early last year. They all supported that India achieved natural immunity before the latest outbreak and countless deaths. They have never apologized.  

While I hated the draconian rule in China and disliked wearing masks, we have to be open to evidence from the world. 

Being conservative is not always wrong!"
2021-06-09 20:18,"""Beijing has demanded that travelers from dozens of countries spend two weeks in employer-supervised quarantine even before flying to China. Once there, travelers must spend at least two weeks and sometimes three or longer in government-supervised quarantine, even if they are fully vaccinated.""

At least on this front, sounds to me like China is doing things about right. I wish we had two weeks of government-supervised quarantine for anyone visiting the United States, and I wish we'd had that policy in place starting in February 2020.

As for: ""Foreign businesses have worried that those limits on international travelers could snarl their plans."" Inconvenience for international travelers is pretty low on the world's list of concerns right now."
2021-06-09 20:17,"England, China, coulpa counties in Tennessee...seeing 700% infection increase over past 14 days. Time to pay attention again.

GA sitting on a solid 30% vaccination rate.  Meanwhile other does going to waste..?? Only in America"
2021-06-09 20:17,"What they’re doing is incredible.  We look like complete wimps compared to them.

If we ever do go to war with them they really might win."
2021-06-09 20:21,"BTW, the 157 inpatient is way overblown. The authorities there are completely narcissistic with this. Anyone who is positive will be admitted for 14 days. This is irrespective of any symptoms. There is mass testing going on with over 10 million test alone. I guess this is better then the alternative.  There should be herd immunity by the fall in China by the speed they are going"
2021-06-09 20:26,"Don't trust anyone as far as the pandemic is concerned. Each time a country makes a bold claim that they have beaten back the virus, it comes back with a vengeance. This virus respects immunity and humility. Humility about what we don't know and we need humanity so that we care about each other."
2021-06-09 20:35,"I'm fully vaccinated, but still wearing a mask in indoor public spaces for the foreseeable future.  It is crazy that the US has a complete supply of vaccines, yet millions and millions are  refuseniks for various foolish and selfish reasons..."
2021-06-09 20:42,"I am so tired of the endless China bashing that our government and media has engaged in. This article with its cherry-picking and baseless insinuations is a perfect example. It is counterproductive at best and dangerous at worse.

By focusing on scapegoating China, we have on both conscious and unconscious levels reinforced the perception of China as ""other"". I believe that this has been part of the reason that our response has been so delayed and inadequate. Remember the ""relief"" when this hit Italy because then we would get some ""real"" information and see how a modern Western nation could successfully deal with Covid without resorting to the ""draconian"", ""totalitarian"" and ""Maoist"" strategies employed by China. Then to our astonishment and horror, we saw this thing literally steamroll Italy. Oops. It really doesn't matter what China publicly said, they gave us a step by step playbook of how to handle this. What they did to contain and mitigate was literally visible by satellite and based on sound reasoning and science. If we did not see them as ""other"" we would have appreciated the severity of the threat sooner and would have followed their, now proven, strategies. We are blaming them for our own failures and continuing to do so will jeopardize the global cooperation that is required to deal with this and future pandemics.

The fact is that China's vaccines are just as effective as Pfizer or Moderna, and more versatile; they protect against mutations. NYT should admit this."
2021-06-09 20:49,"God help us if there is an alien invasion :-)
The world reaction to the pandemic is a good preview.

The virus is not going away until this is dealt with at a global scale. It still is a wonderful opportunity for everyone to come together and build a template of cooperation that can be used for the other impending disasters like climate change and ecological extinction of species..."
2021-06-09 20:51,"People are reluctant to take vaccines. It is the same everywhere.  NY Times reported yesterday that Houston Methodist Hospital put about 200 medical professional on alert since they don't want to take shots for one reason or another.  Not to mention that China has about 1.4 billion people. It is very difficult to convince the majority of people to get a jab in their arms since China pretty much has been free of virus for sometime and people's lives are back to normal already.  Why bother?

Luckily, Guangzhou is not one of the most important and traveled cities in China.  Its neighboring Shenzhen is. Foreigners normally go to Hong Kong & Shenzhen for business and high tech products.

But once you are there and overcome the initial hurdle of observation period, you are born free to go places and have fun."
2021-06-09 21:00,"Nothing unusual about here beyond some strange China bashing. 

The reaction to the breakout is very similar to what happens in Australia and New Zealand. None of the countries that have  eliminated the virus are complacent about the Delta variant and the key remains to have zero tolerance for any outbreak. ￼￼￼That means instant lockdowns and surges in testing."
2021-06-09 21:01,"""The city tested practically its entire population of 18.7 million between Sunday and Tuesday, some of them for the second time.""  Whatever else anyone might say about China, this quote leaves me with a sense of awe and admiration for the determination of the Chinese people.  While we talk about our ""freedoms"", we've lost almost 600,000 lives in pursuit of our right to NOT have to wear masks or protect others by protecting ourselves."
2021-06-09 21:03,"With a population of 1.4 billion, China has only administered 800 million doses. Even if those vaccinated had already had two jabs, just around 400 million peple would have been fully vaccinated. 
Once again China’s statistics are too good to be true - it has  a total of some 91,300 confirmed infections, and  the death toll stands unchanged at 4,636.
Early this year, both China and India tried to outdo each other in their vaccine diplomacy by stepping up their contribution to poor countries.   
That China has been spooked by a rise of Covid-19 infections since May sends a signal that Beijing must do everything possible to get the pandemic under control, for the sake of hosting the Winter Olympics in February 2022. Imagine the schadenfreude in the West if the event were cancelled. There had been calls to boycott the Olympics due to China’s handling of the Uighurs."
2021-06-09 21:10,a stitch in time could have saved nine
2021-06-09 21:11,"considering that the US won't reach the magical 70% fully vaccinated level by July 4th, or ever, and every state is opening up, be afraid. be very afraid that we'll have a resurgence."
2021-06-09 21:15,they did a better job making the virus than the vaccines.
2021-06-09 21:13,"""The city tested practically its entire population of 18.7 million between Sunday and Tuesday...""

Has the NYT attempted to confirm this claim? 

Over a 3-day period, this would require processing, testing and administering results for an average of 260K people per hour 24 hours per day; tens of thousands of testers working around the clock, presumably in hundreds of facilities. 

Certainly China has a ""can-do-anything-it-puts-its-mind-to"" reputation, but this statistic gives me pause."
2021-06-09 21:22,How is it that a prochina comment posted 3 minutes ago gets over 70 recommendations?
2021-06-09 21:23,"So many people are missing the forest from the trees. The only way to ever really deal with the pandemic was, is, and will be vaccines in 70-80% of the population. That's it. 

It's true that Australia/NZ/China can take draconian measures to limit infections: lock down entire cities, make people get tested, etc, but who really wants to live like that? 

As Aaron Carroll wrote earlier this week, covid won't ever go away. Epidemiologists think that after enough time, it's likely that it will become more like a common cold and less like the current disease. We just need to get local case counts to the point where we have an acceptable level of deaths. As Carroll wrote, in a normal flu year, 100 people die on average/day. We've accepted that risk for decades, and the same will be for covid. 

For all of our problems in the US, we have rationally accepted that covid won't be eliminated, and there here will always be some deaths, even with 70-80% of the population vaccinated. To lock down a population every time there's a small cluster of infections is ridiculous and, quite literally, inhumane. Time to face reality and just get on with normal life. 

And yes, we absolutely have to prioritize vaccinating the entire world as best as we can."
2021-06-09 21:48,We must support Australia in its quest for a full independent enquiry as to the origins of this virus which has killed millions and left economies and lives ruined. The WHO has proven itself not to be fit for purpose in this regard. China may be a commercial powerhouse however it's plagiarism on the back of a distorted regime that is Communism will never allow it to flourish in the long term. Not one state in history has ever survived such controlled fiefdoms - China will be no exception.
2021-06-09 22:02,"I'm in Shanghai.  I may have been in China too long, but I believe that this country's lockdown measures and entry restrictions are effective, that they will get a handle on the Delta variant before it spreads further, and they will inoculate 70-80% of their population before the end of the year."
