Date,Comments
2021-06-15 14:49,"My compliments on an excellent summary on the current FDA scope of challenges and the need for a permanent commissioner. Regarding the aducanumab approval for Alzheimer's I think the analytical basis for approval may not yet be publicly available, but might be similar to this one (<a href=""https://www.fda.gov/media/143504/download"" target=""_blank"">https://www.fda.gov/media/143504/download</a>) where functional impairment(symptoms, memory) improved and there was dose-response for imaging results. So, there is an efficacy signal although there is not overall integration with safety risk. Unless we change our laws FDA does not regulate drug cost so it seems unfair to criticize them on this issue. Likewise, linking Dr. Woodcock's support for approving narcotic drugs for pain relief to the US addiction epidemic seems misguided. That responsibility is with prescribing MD's, dispensing pharmacists, wholesalers, state regulators and federal agencies like DEA....not Janet Woodcock. She has been an outstanding new drug approval head who could well lead FDA."
2021-06-15 16:00,"Joe Biden and the Senate are neglecting their duty to appoint new commissioners to head the FDA, DOJ Antitrust Division, and FTC. He nominated Lina Khan to Rohit Chopra's FTC seat (great choice) but still hasn't named anyone to the vacant seat, leaving a 2-2 partisan deadlock. Furthermore, the Senate keeps going on vacation while nominees wait in limbo. They need to treat the competent administration of this country's executive with far more urgency than they have demonstrated."
2021-06-15 16:50,"I've been on the fence about getting the Coronavirus vaccines, because it feels like we're all lab rats being experimented on with a new technology that was approved without safety studies by a corrupt agency.  This article pretty much confirms my suspicions.  Just because it's an emergency and it's convenient doesn't mean it's safe."
2021-06-15 17:14,Seems no standards were used for approval. Just thoughts and prayers.
2021-06-15 17:33,"The use of a surrogate marker to approve a new drug was originally advocated by AIDS advocates. Until the mid '90's, the FDA required a clinical endpoint such as death to approve new HIV medications. Around that time, AIDS researchers noticed that a new PCR assay measuring viral quantity, or viral load, strongly correlated with clinical endpoint. That became the proposed surrogate marker, but only after a careful statistical review of multiple studies. The use of a surrogate marker for the new Alzheimer's drug has none of that math or science behind it. It is an untested hypothesis, and we the American people are now the financial victims of this fraud."
2021-06-15 16:56,"As they always say

Follow the money.

This decision is a disgrace and a stain on the FDA."
2021-06-15 20:58,"As a clinical research physician familiar with FDA reviews, I am appalled that FDA has gone against its advisory committee and along with Biogen to approve aducanumab for all Alzheimer cases.  This drug is a joke and should never been prescribed to patients.  It is also quite unsafe. In addition, it will hamper future efforts to develop new drugs for Alzheimer as patients who trust FDA judgment may prefer to go on with aducanumab.

Woodcock has to go, a new independent commissioner must be brought in and aducanumab be forbidden for marketing."
2021-06-15 19:52,"Eliminate the F.D.A.
Crazy? Radical?
No to the first question, yes to the second one.
Delay kills, and F.D.A. means delay.
Delaying drug approval kills just as surely as unsafe drugs being sold, if not more so.
Beta Blockers had been used safely for many years in Europe., saving many thousands of lives - despite that fact, the F.D.A. dithered for years before (finally) approving it.
The Washington Post - not exactly a bunch of wild eyed radicals, published a superb article, 'Protected to Death' which estimated that delay killed approximately 200,000 people in the United States.
What about thier lives?
Don't those lives count for anything.
Even if the F.D.A. had unlimited personnel and funding, approval equals delay.
<a href=""https://www.washingtonpost.com/archive/opinions/1989/07/16/protected-to-death/c686a2b6-4cb0-4700-8c00-4a8e5e8ee957"" target=""_blank"">https://www.washingtonpost.com/archive/opinions/1989/07/16/protected-to-death/c686a2b6-4cb0-4700-8c00-4a8e5e8ee957</a>/"
2021-06-15 23:21,"From personal, work experience in clinical research, the very last thing we should all want is for HHS to get more authority over FDA's tasks and responsibilities. FDA got a lot of unwarranted and patently false accusations last year about ""their red tape""  during the worst of the pandemic.  ""Red tape"" is HHS's only research output.

While FDA has many areas detailed in the article that need serious review and substantial correction, much like any critical aspect of our infrastructure, Congress has failed to fund it adequately and give it anywhere near the resources that would be considered adequate for the vast mission that Congress and the American public make it responsible for."
2021-06-10 17:51,"I know she has knowledge and integrity, but sometimes she's been tone deaf or lacking in common sense. The sudden swing from over-caution to free-for-all was jarring, confusing, and possibly hazardous. And while the political influences may be less overt than in the Trump days, there is no doubt that for a while the teachers unions, not the science or the scientists, were calling the tune on school opening guidance. Her honor-system guidance for no masks needed for the vaccinated ignores the fact that many people who are vaccinated have underlying conditions that may make them wide open to infection."
2021-06-10 18:01,"I am convinced that she should have known that the people who avoid being vaccinated are the same who would stop wearing masks. That decision seemed clearly aimed at pacifying Trump supporters at the expense of those who are, for many SCIENTIFIC reasons, very cautious."
2021-06-10 18:11,"Huge respect for Dr Walensky, her command of facts and science, and her ability to convey empathy for those effected by the pandemic.

However, she doesn’t appear to have been schooled in the complexities of communications structured to move society from one stage on to the next.  It’s time to expand the CDC’s director role to be more than just a gatekeeper for health science.

Take a cue from the organizational change and communication departments of large global enterprises. All official communications can be viewed from the perspective of senders and receivers. Unfortunately senders and receivers often don't participate in a true dialogue at the onset of a change. They talk right past one another. 

Imagine a people manager who sits down with an employee to discuss a major organizational restructuring project. The manager shares the information in an enthusiastic and positive way. She covers all the key messages, including the risk of not changing and the urgency around changing the structure for competitive reasons. If a people manager spends too much time talking about the business and not enough time talking about the implications to the employee then much of the key business information communicated by the people manager to the impacted employee in this first conversation goes unheard. Why? The message is overshadowed by the employee's concerns about job security and fear of change.

Dr Walensky should create a public health change management department within the CDC."
2021-06-10 18:17,"I saw my doctor for a routine check up today.   We talked about the confusion over this.   She said she thinks we will know in a couple of months whether booster shots are needed for those among the first to receive the vaccines 6 months ago.   Until then we should continue to be careful since there is no way to know who is or isn’t vaccinated.
And I note that medical offices and even vets are still keeping covid precautions in place.   So that seems to be where we are after the mask off announcement."
2021-06-10 18:18,"Walensky’s decisions are so counter to the fundamental principles of public health that I am embarrassed to be a practitioner. Her reckless announcement about masks will likely be a case study in poor risk communication, decision making, and leadership for my public health students in the fall."
2021-06-10 18:21,"When I earned my MPH in Epidemiology in 1981, the CDC was respected as the source of national health data for all health/medical institutions and was taken as the model to copy by other nations. Top CDC officials (not necessarily the director) came on TV news during epidemics to update the public on the the status of the epidemic, the risks to persons and the plans for keeping us safe. These briefings told me we were in good hands. I don't recall D.C. being much involved in pontificating on public health matters in those days.

I knew it would take time to build back the CDC to its former glory, but I did expect the new director to resume communication to the public in this anxious time of our pandemic. I had read in JAMA that the daily briefings during Taiwan's first Covid 19 wave was highly effective in building trust. The briefings were given by a noted virologist who just happened to be Taiwan's VP.

Why Dr. Walensky, who certainly has the communication skills as well as the knowledge to take on this role, has not done so is a puzzlement. I'm guessing she's been caught up in the morass of the current CDC. 

But I wonder if Deputy Director Schuchat, who has shined in all her public announcements, could have shared the communications role with Dr. Walensky. I would have loved to hear her voice on the state of the pandemic. So I'm wondering, is this what the CDC has become, a storehouse of talent that doesn't get to surface?"
2021-06-10 18:22,"The CDC is actually not doing their due diligence in “following the science.” Other countries with access to the same data, like Germany, are not advocating for the emergency use authorization of MRNA vaccines in healthy children and teenagers. The British Medical Journal editorial board has spoken out against the use of these vaccines in children. The European vaccine passport system recognizes natural immunity as sufficient protection against covid infection, the CDC does not. The CDC vociferously defended the theater of outdoor masking when all the evidence pointed to the fact that there is virtually no outdoor spread of the virus. Their messaging is consistently inconsistent and more a reflection of current political attitudes and goals than actual empirical evidence."
2021-06-10 18:04,"The CDC’s inconsistent messaging has been especially damaging to children and working parents. It allowed teachers unions to meddle in its reopening announcement earlier this year, releasing guidance that was more cautious than the science indicates and that ultimately denied millions of children a swift return to school. 

Compare the CDC’s hamfisted messaging with that of the European CDC, which is simple, science-driven, and is not shy about weighing the significant harms of closed schools against the minimal harms of reopening. It also only recommends masks for kids older than 12. Where is our CDC on this?

<a href=""https://www.ecdc.europa.eu/en/publications-data/children-and-school-settings-covid-19-transmission"" target=""_blank"">https://www.ecdc.europa.eu/en/publications-data/children-and-school-settings-covid-19-transmission</a>"
2021-06-10 18:12,Like making two year olds wear masks
2021-06-10 18:43,"It has not been a great time for Drs Wallensky and Fauci to say the least.

Both their and their fellow celebrity epidemiologists complete lack of candor with the public during the vaccine rollout non-delivery by big Pharma, state and local government and commercial designated providers, following the disgraceful capitulation of Dr Birx to Trump, will be a subject of historical criticism of the specialty and deservedly so.

Talkers not doers one and all."
2021-06-10 18:48,Trust the science and stay apolitical but take guidance and direction from the Teacher's Unions. Why has the Times failed to mention how CDC's guidance around school re-opening was directly impacted by communication between the CDC and the unions? It is not only Trump who has politicized the CDC.
2021-06-10 18:29,"shes had her stumbles for sure but is light years better than the ""leaders"" we had there in the last Administration"
2021-06-10 18:52,"Science is the real world.  The CDC is dedicated to the pursuit of science, including that of human behavior.  
Covid itself was a surprise to the world.
Dr. Walensky did not call Covid a hoax.  She did not recommend unproven therapies for its treatment.  She is not saying that Dr. Fauci caused the epidemic.  She is not minimizing the efficacy of masks.  
What she is saying is that those who are protected by vaccination for Covid may reconsider the necessity of mask wearing and have more freedom from that in their lives.  OK, some people were surprised at her opinion.  
Compared with our ignorance and the disinformation we had to cope with at the beginning of the pandemic, surprise would seem to me to be something we can manage. 
I hope we  can accept this Doctor's leadership, support it in the days to come in the face of our ignorance regarding the virus and our need to cope with the unknown course of the continuing pandemic.  
Friends, we are nowhere near the finish line with Covid.  I suspect there will be surprises to come."
2021-06-10 18:52,"I respect Dr. Walensky and I'm not willing to judge her performance yet. Let's give her some time to find her way.

But one thing puzzles me. If vaccinated people no longer need to wear masks, why do we need to continue wearing them in medical facilities and offices?  All of my doctors are vaccinated and I'm vaccinated, so why do they and I need to wear masks for routine appointments? Either it's safe to go maskless indoors or it's not. I have no problem wearing a mask and still wear one when I'm indoors with others when I don't know their vaccination status, but I think the CDC is sending mixed messages. If the vaccinated don't need masks in supermarkets, restaurants and movie theaters, why should medical facilities be any different?

If the CDC wants our trust, they need clear, detailed, consistent messaging."
2021-06-10 19:03,Telling people to shed masks without proving their vaccination status wasn’t following the science.  Failing to protect the immune improvised and unvaccinated children was not following the science.
2021-06-10 19:12,"Apparently some folks might prefer to listen to bleach being injected as “medical advice”? Or UV light directed inside a human body?

Suggest you go to that source then for your pandemic info/infectious disease recs.


Dr Walensky is doing a great job. When did. doing the right thing well become a problem? Controversial even?"
2021-06-10 19:16,What happened to her 'sense of impending doom'? Right when covid was on the wane and vaccinations up? I guess 'the science' didn't care about reality. It was political and everyone knows it.
2021-06-10 19:36,"The stupidity of what is essentially an ""honor system"" regarding wearing masks is worthy of the Trump administration. How could you not know that the people who would immediately discard masks were the ones who had resisted them in the first place? And worse, now unvaccinated people have even less reason to get vaccinated as the numbers attest. I fear this was a cynical move made for economic reasons which will backfire."
2021-06-10 19:23,"Ed Yong in The Atlantic gives the non-PR-placement view of Walensky’s about-face(mask) here:  “Science doesn’t stand outside of society,” Cecília Tomori, an anthropologist and a public-health scholar at Johns Hopkins, told me. “You can’t just ‘focus on the science’ in the abstract,” and especially not when you’re a federal agency whose guidance has been heavily politicized from the get-go. In that context, it was evident that the new guidance “would send a cultural message that we don’t need masks anymore,” Tomori said. Anticipating those reactions “is squarely within the expertise of public health,” she added, and the CDC could have clarified how its guidelines should be implemented. It could have tied the lifting of mask mandates to specific levels of vaccination, or the arrival of worker protections. Absent that clarity, and with no way for businesses to even verify who is vaccinated, a mass demasking was inevitable. “If you’re blaming the public for not understanding the guidance—wow,” Duke’s Gavin Yamey said. “If people have misunderstood your guidance, your guidance was poor and confusing.”

There’s much more here: <a href=""https://www.theatlantic.com/health/archive/2021/06/individualism-still-spoiling-pandemic-response/619133"" target=""_blank"">https://www.theatlantic.com/health/archive/2021/06/individualism-still-spoiling-pandemic-response/619133</a>/"
2021-06-10 19:39,"When someone says that a person or institution “follows the science”, this is coded language that really means “uses science to pursue a political agenda”.   Case in point is her using school Union talking points to change CDC guidelines to satisfy school unions."
2021-06-10 19:56,"I think wearing a mask in public for over a year is enough, vaccine or not. There's a lot of stuff normal humans do that happens without a mask. I'm super happy she did that and gave the vaccine legitimacy. I can't imagine walking in everywhere wondering if I should wear a mask. The cases are going way down and vaccinated people have almost no risk."
2021-06-10 19:59,"So far, a mixed bag. And she certainly deserves more time to settle in and find her mojo. But, to answer the headline’s question, yes, the nation’s CDC leader must be more than a slave to science. For one, health is a dynamic not a single laboratory test. The director should prioritize and respect any particular source of “science” (which itself is imperfect) and avoid serious risks. But in any profession, especially those based on science and math, great leaders exercise greater vision and perspective. 

I recall Bloomberg’s failed presidential bid where he claimed the CDC was gutted by Trump.  The CDC has eleven thousand employees, most with advanced degrees, and large budgets.  She needs to build a better CDC. As a leader, she can’t coddle those who will wear masks alone in the bathtub, I agree that she should be guiding us back to normality as soon as reasonably possible. She relies a bit too much on the content cards just to her right, and the ease of which she evoked “systemic racism” in healthcare signaled that she just might be another political operative.  If blacks or any ethnic or poor (majority white) constituency isn’t getting access to health care, analyze and define the gaps and propose solutions. We need her to be above the political fray."
2021-06-10 20:06,"Dr. Walensky orients herself to pleasing powerful people. 

In Massachusetts she catered to the wishes of libertarian, business-first Gov. Baker (R). Now she caters to the goals of the Democratic Biden administration. 

If somewhere along the way, she discovered her own convictions, that would be very good for the country. Is it likely? We will see."
2021-06-10 19:55,"Thank You Dr. Walensky for restoring the CDC to a level of trustworthiness that it lost under DT!

Perhaps the CDC can create a panel of doctors to filter their messaging before releasing it to the public.  My guess is that the confusing messaging was meant as encouragement to get vaccinated, in other words a carrot: ""if you're vaccinated you can take of your mask in many settings"". The problem is that many people refused to wear masks until forced to and now they can take them off inside and nobody can say anything! Many of these are the same people who refuse to vaccinate. Consequently we can now have potential unvaccinated super-spreaders running around in indoor settings and not even a manager can intervene!

I think it would have been better to err on the side of caution by waiting till the vaccination rate was  much higher and daily  case numbers were lower before removing the mask mandates.

I think a carrot and stick policy would still be useful:

Carrots:
commercials that emphasize vaccine efficacy & safety; the patriotic, altruism of vaccinating: saving self, family, friends, community, healthcare workers, etc.; saving the economy; return to normal life

Sticks:
Vaccine passports with enforcement mechanism - no public travelling if you haven't been vaccinated; no public services; end of unemployment benefits; health insurance companies and Medicare no longer covering anything covid-19 related if you are capable but refuse to vaccinate; holding unvaccinated liable"
2021-06-10 20:08,I'm disappointed that the CDC did not maintain masking in indoor setting such as stores without a verification mechanism. It's meaningless otherwise.
2021-06-10 20:00,"Once you step out of the coastal, college educated, NYT-reading bubble, you realize that many people tuned out public health covid guidance a long time ago. This happened either because it was impractical (can't stay home when you have an in person service/labor job) or too complicated for folks who aren't science or news junkies already.

In this respect, I think Dr. Walensky understands the social engineering aspect of covid better than her critics. You need a crisp message to cut through the apathy and political noise. ""Get the shot, get your life back"" is both simple and scientifically accurate, in the sense that vaccines reduce your risk from covid to the level of other normal daily activities like driving a car or catching the flu.

Continuing to issue hair splitting, overly conservative recommendations that are ignored by the majority of citizens is no way to rebuild the CDC's credibility. Thank you to Dr. Walensky for realizing this and changing course."
2021-06-10 20:10,"Why would the CDC give the advice to stop wearing masks for vaccinated people when we have new variants cropping up around the World all the time that might outsmart the vaccines?
It seems it would have been prudent to keep them on.

Beijing, China has instituted strict measures again to fight a new outbreak.  Other areas around the world are having problems with more contagious and deadly variants.

Since this is a new disease it doesn't seem like now is the time to throw caution to the wind."
2021-06-10 20:09,"The headline “Is that enough?“ seems misplaced. And about “‘uncertainty and disappointment,’ from a senior C.D.C. scientist?  This is another institution slowly recovering from the previous administration’s damage, causing mistrust within and without. Cut them some slack, give them some time."
2021-06-10 20:12,"Does anybody expect other than such a heading from NYT about the new CDC head? But the fact is that this head is more political than the previous head? She reversed many positions to suit her political views regarding reopening of businesses, masks after getting vaccinated and school reopening. When TX governor opened his state I saw her shedding tears predicting disaster! But a month later she followed him!"
2021-06-10 20:22,"ARE. YOU. SERIOUS?

Behavioral science?  What the insistence on keeping up per formative and unnecessary NPIs to make some people feel better about their inability to comprehend risk?

Please. I think she’s done a great job."
2021-06-10 20:26,"The author of this piece has no credibility after her tweets condemning an international inquiry into the origins of COVID 19 

Sorry!"
2021-06-10 19:00,"“…The C.D.C. floundered…pilloried for its botched coronavirus test and antiquated data systems. Its advice on masking, asymptomatic spread…and the threat indoors was muddled…

If it were only that bad – unfortunately, more like:

<a href=""https://www.nature.com/articles/d41586-020-00210-5"" target=""_blank"">https://www.nature.com/articles/d41586-020-00210-5</a>

27 January 2020

𝗨𝗦 𝗼𝗳𝗳𝗶𝗰𝗶𝗮𝗹𝘀 𝗿𝗲𝘃𝗶𝘀𝗶𝘁 𝗿𝘂𝗹𝗲𝘀 𝗳𝗼𝗿 𝗱𝗶𝘀𝗰𝗹𝗼𝘀𝗶𝗻𝗴 𝗿𝗶𝘀𝗸𝘆 𝗱𝗶𝘀𝗲𝗮𝘀𝗲 𝗲𝘅𝗽𝗲𝗿𝗶𝗺𝗲𝗻𝘁𝘀

“…An expert panel is considering how much to reveal about a largely secret review process of 'gain-of-function' research…

“…Defending against biothreats by developing countermeasures looks a lot like an offensive bioweapons programme…

But wait – there’s more:

<a href=""https://www.nature.com/articles/480421a"" target=""_blank"">https://www.nature.com/articles/480421a</a>

Published: 20 December 2011

𝗙𝗲𝗮𝗿𝘀 𝗴𝗿𝗼𝘄 𝗼𝘃𝗲𝗿 𝗹𝗮𝗯-𝗯𝗿𝗲𝗱 𝗳𝗹𝘂

“…Since September, news has been circulating about two groups…who have reportedly created mutant H5N1 variants that can be transmitted between ferrets merely breathing the same air…

“…raises the spectre of a disease that spreads as fast as ordinary seasonal flu, but with a fatality rate akin to wild-type H5N1… 

“…conducted in labs rated at ‘biosafety level 3 (BSL-3)…Such labs require scientists to shower and change clothes when leaving…and include other safety features such as negative air pressure and passing exhaust air through high-efficiency particulate air filters. This should be quite sufficient to provide protection against an accidental release…some virologists say…"
